{
  "version": "docx-2025-11-24",
  "updated_at": "2025-11-24",
  "source": "docs/TO XIAOMA 20251124(2).docx",
  "scenes": {
    "S1": {
      "name": "拦打隐身战斗机",
      "initial_tasks": [
        "实施进攻性制空作战",
        "建立持续空情监视"
      ],
      "tactical_preferences": [
        "诱骗雷达开机",
        "无源探测",
        "多平台交叉定位",
        "有人机置后",
        "无人机中继制导"
      ],
      "evidence": "TRR-001-001/002/006/011 命中后的任务议程与战术偏好"
    },
    "S2": {
      "name": "拦打非隐身战斗机",
      "initial_tasks": [
        "实施进攻性制空作战",
        "建立持续空情监视"
      ],
      "tactical_preferences": [
        "预警机雷达探测和持续跟踪",
        "有人战斗机前出拦截",
        "预警机统一分配目标"
      ],
      "evidence": "TRR-001-001/003/006 命中后的任务议程与战术偏好"
    },
    "S3": {
      "name": "打击水面舰艇",
      "initial_tasks": [
        "实施对海打击",
        "实施区域电磁压制",
        "建立广域海域监视"
      ],
      "tactical_preferences": [
        "饱和/多轴向协同攻击",
        "实施电子压制",
        "天基/空基联合侦察"
      ],
      "evidence": "TRR-001-004/007/008/009 命中后的任务议程与战术偏好"
    },
    "S4": {
      "name": "压制地面防空",
      "initial_tasks": [
        "实施防空压制/摧毁",
        "建立电磁频谱监视"
      ],
      "tactical_preferences": [
        "软硬杀伤一体化",
        "有人-无人交叉定位",
        "无人平台承担高风险攻击"
      ],
      "evidence": "TRR-001-005/004/008/009 命中后的任务议程与战术偏好"
    }
  }
}
